url,title,text
https://aib.ps/content/about-bank,لمحة عن البنك,"تأسس البنك الإسلامي العربي في العام 1995 وهو شركة مساهمة عامة، وباشر نشاطه المصرفي في مطلع العام 1996، ويقوم بممارسة الأعمال المصرفية وأعمال الإستثمار وفقاً لأحكام الشريعة الإسلامية من خلال المركز الرئيسي بمحافظة رام الله والبيرة وفروعه المنتشرة في فلسطين إضافة الى المكتب التمثيلي في الإمارات العربية المتحدة (إمارة دبي) والفرع المتنقل ""بنكي ع الطريق"" ليصل عدد فروعه الى واحد وثلاثون فرعاً ومكتباً بالإضافة إلى 64 صراف آلي منتشر في كافة محافظات الوطن، كما لايوجد للبنك أي شركات تابعة حتى تاريخ 31/12/2023.
بنك اسلامي وطني متميز، تقوده الرقمية والحداثة والاستدامة المصرفية والموارد البشرية المتميزة لتقديم الخدمة المصرفية المتوافقة مع الشريعة الإسلامية وذات الجودة العالية حيثما كان العملاء بطريقة آمنة.
تقديم حلول وخدمات مصرفية إسلامية عصرية شاملة وذات جودة عالية ومنافسة، ودعم وتطوير الحلول المبتكرة للأجيال القادمة والأعمال الريادية، انطلاقاً من قيمنا المتجذرة في عالم المال والأعمال والصيرفة الإسلامية والمساهمة في التنمية الاقتصادية وتحقيق مبدأ التكافل و التعاون والأهداف الاجتماعية الإسلامية."
https://aib.ps/content/chairmans-speech,كلمة رئيس مجلس الادارة,"كلمة رئيس مجلس الإدارةالسيدات والسادة المساهمون المحترمونالسلام عليكم ورحمة اللّه وبركاته،،،
بالأصالة عن نفسي ونيابة عن زملائي أعضاء مجلس الإدارة، يسعدني أن أقدم لكم التقرير السنوي للبنك الإسلامي العربي للعام 2024، والذي يعرض إنجازات البنك وبياناته المالية المدققة للسنة المنتهية في 31 كانون أول 2024. يأتي هذا التقرير في ظل تحديات استثنائية يمر بها أبناء شعبنا الفلسطيني بسبب الحرب القاسية التي تعرضت لها الضفة الغربية وقطاع غزة بشكل خاص، والتي ألقت بظلالها الثقيلة على الاقتصاد الوطني، وأثرت بشكل مباشر على القطاع المصرفي.
لقد كان عاماً مليئاً بالصعاب، إلا أنه كشف أيضاً عن قوة وعزيمة شعبنا، وصلابة مؤسساتنا، حيث أننا بفضل الله ثم بدعمكم وثقة عملائنا الاعزاء، نجح البنك في تحقيق العديد من الإنجازات التي تعكس قدرته على الصمود والنمو وواصل أداءه المتميز في تحقيق استقرار مالي قوي يعكس استراتيجيته القائمة على النمو المستدام مع الالتزام التام بمبادئ الشريعة الإسلامية. وليستمر البنك كأحد أكبر البنوك في السوق المصرفي الفلسطيني.
وعلى صعيد المؤشرات المالية، واصل البنك الحفاظ على قاعدة أصول متينة، مع استمرار ضبط المصاريف التشغيلية وتعزيز السيولة والجدارة الائتمانية. فيما استمرت محفظة التمويلات المباشرة عند مستويات قوية بلغت 1,104 مليون دولار، كما وصلت ودائع العملاء إلى 1,417 مليون دولار. وبلغ صافي الدخل حوالي 1.12 مليون دولار، مع الإشارة الى قيام البنك بتبني سياسة تحوطية متقدمة من خلال اخذ مخصصات ائتمانية كافية ووافية تصل إلى حوالي32 مليون دولار لمواجهة أية خسائر محتملة في الضفة وغزة، بما يعكس التزام البنك بالحفاظ على استقراره المالي وتعزيز قدرته على مواجهة التحديات المستقبلية بثقة ومرونة، إضافة إلى إدارة فعالة للمخاطر من خلال أخذ المخصصات اللازمة لمواجهة التحديات الاقتصادية.
خلال عام 2024، واصل البنك جهوده لتحقيق التحول الرقمي من خلال إطلاق مجموعة من المشاريع والمنتجات التي تعكس التزامه بتلبية احتياجات العملاء المتغيرة وتعزيز الشمول المالي. شملت هذه الإنجازات إطلاق تطبيق Soft POS الذي يحول الهواتف الذكية إلى نقاط بيع متكاملة، مما يتيح للتجار استخدام حلول دفع مبتكرة وسهلة. كما تم تعزيز خدمات التحويل الفوري عبر إطلاق منصة ""Iburaq""، لتمكين العملاء من إرسال واستقبال الحوالات بشكل فوري بين البنوك داخل فلسطين من خلال الموبايل بانك والخدمات المصرفية عبر الإنترنت. بالتوازي مع ذلك ايضا تم تفعيل منصة ""E-sadad""- التي انشأتها سلطة النقد والتي توفر إمكانية دفع الفواتير والأقساط والمدفوعات المختلفة للشركات والجهات الحكومية والجامعات والبلديات والنقابات، مما يعزز ويسهل من استخدام وسائل الدفع الالكتروني بدل الكاش وتشجيع التحول الرقمي.
وفي إطار تحسين تجربة العملاء والتسهيل على عملائنا وخصوصاً أهلنا في قطاع غزة باستخدام الخدمات الالكترونية، قدم البنك خدمة تتيح استخدام التطبيق البنكي دون الحاجة إلى شراء حزم إنترنت، كما تم الاستحواذ على مقسم مدفوعات جديد (Pay Way) لتحسين كفاءة عمليات الدفع والتحويل وتعزيز مرونة النظام المالي. وعلاوة على ذلك تم تنفيذ مشروع تصنيف البيانات الذي يعكس التزام البنك برفع مستوى الأمان وحماية بيانات العملاء والبنك على حد سواء. هذه المشاريع الطموحة تؤكد حرص البنك على تقديم حلول مبتكرة وشاملة تدعم رؤية الشمول المالي وتوسيع قاعدة العملاء وتلبية احتياجاتهم.
إيماناً منا بمسؤوليتنا تجاه مجتمعنا، ساهم البنك خلال العام 2024 أكثر من 410 ألف دولار لمبادرات المسؤولية الاجتماعية والاستدامة التي شملت عدة قطاعات هامة ومنها التعليم والصحة، بالإضافة إلى مبادرات مكافحة الفقر، ساعين من خلالها إلى إحداث أثر إيجابي في حياة أبناء شعبنا في مختلف مناطق الوطن. وفي ظل الظروف الإنسانية الصعبة التي يمر بها أهلنا في قطاع غزة، كان من أولوياتنا تقديم يد العون لهم، حيث وُجّه حوالي 70% من هذه المساهمات لدعم صمودهم من خلال مشاريع الإغاثة الطارئة والمساهمة في برنامج كفالة الأيتام. ويظل التزامنا بالمسؤولية الاجتماعية والاستدامة ليس مجرد شعار، بل هو جزء أساسي من هويتنا وقيمنا ونعمل جاهدين لتعزيز رفاهية المجتمع وتحقيق أثر إيجابي دائم.
إننا في البنك الإسلامي العربي نطمح دائماً إلى تحويل التحديات إلى فرص لتحقيق المزيد من التميز، ونسعى لتعزيز مكانتنا في القطاع المصرفي من خلال الاستمرار في تحسين الكفاءة التشغيلية، وتوسيع قاعدة عملائنا، والاستثمار في رأس المال البشري. كما نعتزم مواصلة دعم مجتمعنا وتعزيز الابتكار الرقمي بما يتماشى مع متطلبات السوق المتغيرة.
وفي الختام، أتوجه بخالص الشكر والتقدير للسادة سلطة النقد الفلسطينية، وهيئة سوق رأس المال الفلسطينية، ومراقب الشركات، وبورصة فلسطين، على تعاونهم ودعمهم المستمر. كما أشكر أعضاء هيئة الفتوى والرقابة الشرعية وجميع الموظفين والعاملين في البنك على تفانيهم وجهودهم الكبيرة لتحقيق هذه النتائج الطيبة.
ايماننا بأن الصمود الحقيقي يكمن في العمل والعطاء والاستمرار في التنمية والبناء رغم كل التحديات. وسيبقى البنك الإسلامي العربي ملتزماً بدوره كشريك فاعل في بناء مستقبل أفضل لوطننا. ونسأل الله أن يمن على شعبنا بالأمن والاستقرار، وأن يوفقنا جميعًا لخدمة وطننا ومجتمعنا بما يعزز من ازدهارنا وتقدمنا.

رشدي الغلايينيرئيس مجلس الإدارة"
https://aib.ps/content/board-of-directors,رئيس مجلس الإدارة، ممثل شركة بنك فلسطين,السيد/ رشدي محمود رشيد الغلاييني
https://aib.ps/content/board-of-directors,نائب رئيس مجلس الإدارة، ممثل صندوق الاستثمار الفلسطيني,الدكتور/ محمد محمود محمد نصر
https://aib.ps/content/board-of-directors,عضو مجلس الإدارة، ممثل شركة بنك فلسطين,السيد/ صقر محمود سليمان جندية
https://aib.ps/content/board-of-directors,عضو مجلس الإدارة، ممثل شركة بنك فلسطين,السيد/ وائل عبد اللطيف خليل الصوراني
https://aib.ps/content/board-of-directors,عضو مجلس الإدارة، ممثل شركة بنك فلسطين,السيد/ عبدالله قيس ثنيان الغانم
https://aib.ps/content/board-of-directors,عضو مجلس الإدارة، ممثل شركة اسواق للمحافظ الاستثمارية,السيد/ فواز محمود يعقوب نجار
https://aib.ps/content/board-of-directors,عضو مجلس الإدارة، عضو مستقل,الدكتور/ وليد فوزي يوسف برغوثي
https://aib.ps/content/board-of-directors,عضو مجلس الإدارة، ممثل شركة اسواق للمحافظ الاستثمارية,السيد/ محمد عوني محمد ابو رمضان
https://aib.ps/content/board-of-directors,عضو مجلس الإدارة، عضو مستقل,الدكتورة/ صفاء علي طه ناصر الدين
https://aib.ps/content/board-of-directors,عضو مجلس الإدارة، ممثل عن صغار المساهمين,السيدة/ سمر زهدي خليل صوالحي نخلة
https://aib.ps/content/board-of-directors,عضو مجلس الإدارة، عضو مستقل,السيد/ صائب ابراهيم محمد سمور
https://aib.ps/content/executive-management,مدير عام البنك الإسلامي العربي,السيد هاني صلاح  ناصر
https://aib.ps/content/executive-management,مدير ادارة اعمال الشركات والمشاريع,الدكتور معاوية فهد القواسمي
https://aib.ps/content/executive-management,مدير الادارة المالية,السيد ميسرة حاتم سلامة
https://aib.ps/content/executive-management,مدير ادارة العمليات,السيد أمجد غازي الجعبري
https://aib.ps/content/executive-management,مدير إدارة الرقابة والتدقيق الداخلي,السيد إبراهيم اسماعيل أبو عبدو
https://aib.ps/content/executive-management,مدير ادارة الائتمان,السيد حسان عصام صبري
https://aib.ps/content/executive-management,مدير ادارة مراقبة التمويل,السيد حاتم فوزي صبح
https://aib.ps/content/executive-management,مدير  إدارة المخاطر,السيد سائد مقداد مقدادي
https://aib.ps/content/executive-management,مدير ادارة الموارد البشرية,السيد راتب عبد الله عطياني
https://aib.ps/content/executive-management,مدير ادارة اعمال الافراد,السيد نظام علي الزامل
https://aib.ps/content/executive-management,مدير ادارة الامتثال,السيدة فيروز فتحي ذبالح
https://aib.ps/content/executive-management,مدير دائرة مكافحة غسل الأموال وتمويل الارهاب,السيد طه محمد ابو سرية
https://aib.ps/content/executive-management,مدير دائرة الشبكات والانظمة,السيد مصطفى شريف ابو خيزران
https://aib.ps/content/executive-management,مدير دائرة الشؤون القانونية,السيدة أديبة عبد الله عفانة
https://aib.ps/content/executive-management,مدير دائرة هندسة العمليات والإجراءات والجودة,السيد احمد عبد الكريم عياد
https://aib.ps/content/executive-management,مدير دائرة العلاقات العامة والتسويق,السيد احمد محمد سرطاوي
https://aib.ps/content/executive-management,قائم بأعمال دائرة المبيعات المشاريع الصغيرة والمتوسطة,السيد أحمد محمد قرارية
https://aib.ps/content/executive-management,مدير دائرة أنظمة الأعمال المصرفية,السيد عمار يونس خضيري
https://aib.ps/content/executive-management,مدير دائرة القنوات الإلكترونية والخدمات الرقمية,السيدة ريم مصطفى  جمعة
https://aib.ps/content/executive-management,مدير دائرة العقار والمشتريات,السيد عنان أحمد ترتير
https://aib.ps/content/executive-management,مدير دائرة البيع المباشر للافراد,السيد قيس عطا محمد
https://aib.ps/content/executive-management,مدير دائرة العمليات المركزية,السيد وسيم احمد حج اسعد
https://aib.ps/content/executive-management,مدير دائرة اسواق المال و البنوك المراسلة,السيد سليمان سالم اعرار
https://aib.ps/content/executive-management,مدير دائرة تنمية أعمال الشركات والمشاريع,السيدة تماضر ثريا يوسف
https://aib.ps/content/executive-management,مسؤول علاقات المساهمين,السيدة ليندا محمود الشيخ يوسف
https://aib.ps/content/executive-management,المراقب الشرعي,السيد طارق إسماعيل السيد أحمد
https://aib.ps/content/executive-management,مدير دائرة المتابعة والتحصيل,السيد موسى عبد الرحيم عسراوي
https://aib.ps/content/executive-management,مدير دائرة رأس المال والاستثمار,السيد راكز أحمد بدوان
https://aib.ps/content/executive-management,مدير دائرة العملات الأجنبية,السيد تامر خالد بكر
https://aib.ps/content/executive-management,مسؤول علاقات المساهمين,السيدة ليندا محمود الشيخ يوسف
https://aib.ps/content/executive-management,المراقب الشرعي,السيد طارق إسماعيل السيد أحمد
https://aib.ps/content/executive-management,مدير دائرة المتابعة والتحصيل,السيد موسى عبد الرحيم عسراوي
https://aib.ps/content/executive-management,مدير دائرة رأس المال والاستثمار,السيد راكز أحمد بدوان
https://aib.ps/content/executive-management,مدير دائرة العملات الأجنبية,السيد تامر خالد بكر
https://aib.ps/content/sharia-supervisory-board,آلية عمل هيئة الفتوى والرقابة الشرعية,"تجتمع هيئة الفتوى بدعوة من رئيسها أو بناء على قرار من مجلس إدارة البنك أو بناء ً على طلب أغلبية أعضائها .
يحق لرئيس هيئة الفتوى الدعوة لاجتماعات استثنائية كلما دعت الحاجة إلى ذلك .
لهيئة الفتوى حق الإطلاع الكامل وبدون قيود على جميع السجلات والمعاملات والمعلومات بما في ذلك الرجوع إلى موظفي البنك والمستشارين
إعداد التقارير الدورية التي تقدم للإدارة والتقارير التي تقدم للمساهمين."
https://aib.ps/content/sharia-supervisory-board,مهام وصلاحيات هيئة الفتوى والرقابة الشرعية,"الرقابة على أعمال وأنشطة المصرف للتأكد من توافق أعماله وأحكام فقه المعاملات الإسلامي ومراجعة العمليات للتحقق من خلوها من أي محظور شرعي.
تكوين وإبداء الرأي حول مدى التزام المصرف بفقه المعاملات المالية الاسلامية وتقديم التقارير الرقابية الشرعية الدورية لمجلس الإدارة والتقرير الرقابي الشرعي نصف السنوي والسنوي للهيئة العامة ونشر تقريرها على أن يتضمن التقرير الأنشطة المخالفة للشريعة الإسلامية إن وجدت.
إعداد دليل لإجراءات العمل الشرعية ويشمل مختلف عمليات المصرف وبما يتضمن القواعد اللازمة لضبط التعامل مع المصارف التقليدية.
البت في المنازعات التي قد تنشأ بين الرقابة الشرعية الداخلية وإدارة المصرف بشأن التفسيرات الشرعية ويكون قرارها ملزم للطرفين.
التأكد من وجود نظام رقابي داخلي سليم يضمن تطبيق أحكام فقه المعاملات المالية الإسلامية طبقاً لما تٌقرّه هيئة الفتوى للمصرف، واعتماد برنامج الرقابة الشرعية السنوي والذي يتضمن مراقبة كافة أنشطة المصرف وفق خطة سنوية محددة.
تحديد أوجه الصرف وإجازة عمليات الصرف من صندوق المكاسب غير المشروعة.
اعتماد صيغ العقود اللازمة لأعمال وأنشطة المصرف والاتفاقيات والسياسات والمنتجات والمعاملات والقوائم المالية.
دراسة تقارير وملاحظات المراقب الشرعي المقيم على أداء الأعمال اليومية من قبل الإدارة التنفيذية ومدى توافقها مع المتطلبات الشرعية والتوجيه بما يلزم بشأنها.
تقديم التوجيه والإرشاد والتدريب والتثقيف والتوعية لكافة موظفي المصرف فيما يتعلق بالأحكام الشرعية والفتاوى ذات العلاقة.
اعتماد سياسة توزيع الأرباح وتحميل الخسائر على حسابات الاستثمار.
العمل على إيجاد البدائل الشرعية لأي أنظمة ولوائح وعقود وتطبيقات العمل التي تعرض عليها وعدم التوقف عند الإفتاء بموافقتها أو عدم موافقتها لأحكام فقه المعاملات الإسلامية بحيث تقدم ما تراه مناسبا من مبادرات واقتراحات لمنتجات جديدة إلى الإدارة التنفيذية في المصرف."
https://aib.ps/content/sharia-supervisory-board,المراقب الشرعي المقيم  :,"حاصل على مؤهل علمي بدرجة بكالوريوس على الأقل في احدى التخصصات ذات العلاقة
حاصل على الزمالة المهنية المتخصصة (شهادة مراقب ومدقق شرعي معتمدCSAA)
توفر الخبرة العملية والتدريب المناسب على مهام الرقابة الشرعية"
https://aib.ps/content/sharia-supervisory-board,مهام وصلاحيات المراقب الشرعي :,"فحص وتقييم كفاية وفعالية مدى التزام المصرف بالفتاوى الصادرة عن هيئة الفتوى
التحقق من التزام إدارة المصرف بالفتاوى الصادرة عن هيئة الفتوى في كافة الأعمال اليومية
تقديم التوجيه والإرشاد والتدريب لكافة موظفي المصرف فيما يتعلق بالأحكام الشرعية والفتاوى ذات العلاقة
نشر المعرفة من خلال طباعة الفتاوى والإرشادات والتعليمات الصادرة عن هيئة الفتوى والرقابة الشرعية حول المنتجات والخدمات التي يقدمها البنك
تحديث دليل الرقابة الشرعية كل خمس سنوات على الأقل ويكون مجلس الإدارة وهيئة الفتوى هما الجهتان المخولتان بإقرار أية تعديلات بتوصية من لجنة المخاطر ولجنة الحوكمة والامتثال
إعداد خطة خاصة بالرقابة الشرعية الداخلية يوضح فيها الجدول الزمني للرقابة الشرعية على أن يتم إقرارها واعتمادها من قبل هيئة الفتوى ومجلس الإدارة
إعداد دليل خاص للرقابة الشرعية الداخلية يوضح الأغراض والصلاحيات والمسئوليات على أن يتم اعتماده من هيئة الفتوى والرقابة الشرعي
إعداد تقرير ربع سنوي على الأقل موجه إلى هيئة الفتوى والرقابة الشرعية ونسخة إلى مجلس الإدارة ونسخة إلى لجنة التدقيق الداخلي المنبثقة عن المجلس موضحاً فيه غرض ونطاق ونتائج الرقابة الشرعية الداخلية ورأيها حول التحسينات المستقبلية والعمل التصحيحي ليتم مراجعتها بشأن النتائج أو التوصيات"
https://aib.ps/content/sharia-supervisory-board,General Paragraph,"تم تشكيل هيئة الفتوى والرقابة الشرعية  في البنك الإسلامي العربي والتي تضم في عضويتها ثلاثة أعضاء يحملون درجة الدكتوراة بفقه الشريعة الاسلامية ومن ذوي الخبرة بعمل المؤسسات المالية الإسلامية
آلية عمل هيئة الفتوى والرقابة الشرعية
مهام وصلاحيات هيئة الفتوى والرقابة الشرعية

المراقب الشرعي المقيم  :
تم إنشاء وظيفة مراقب شرعي مقيم يكون مرتبطاً مع هيئة الفتوى والرقابة الشرعية،وتكون تبعيته الفنية لهيئة الفتوى والرقابة الشرعية ويمنع تكليفه بأي عمل يتعارض مع واجباته الرقابية، ويجب أن يلتزم بميثاق الأخلاقيات الصادرة عن هيئة المحاسبة والمراجعة للمؤسسات المالية الإسلامية. ويجب أن يتوفر في المراقب الشرعي بالحد الأدنى المؤهلات التالية

مهام وصلاحيات المراقب الشرعي :"
https://aib.ps/content/prizes,جائزة أفضل بنك إسلامي في فلسطين - مجلة EMEA Finance,2023 - Dec
https://aib.ps/content/prizes,"جائزة أفضل بنك إسلامي في فلسطين - “Palestine Financial Technology Summit Conference ""Fintech",2022 - Oct
https://aib.ps/content/prizes,جائزة أفضل بنك إسلامي في فلسطين - مجلة World Finance,2021 - Feb
https://aib.ps/content/prizes,جائزة أفضل بنك إسلامي في فلسطين - مجلة Global Finance,2021 - Feb
https://aib.ps/content/prizes,جائزة أفضل بنك إسلامي في فلسطين - مجلة Global Finance,2020 - Dec
https://aib.ps/content/prizes,جائزة أفضل بنك إسلامي في فلسطين - مجلة emeafinance,2020 - Dec
https://aib.ps/content/prizes,جائزة أفضل بنك إسلامي في فلسطين - مجلة World Finance,2020 - Dec
https://aib.ps/content/prizes,جائزة أفضل بنك إسلامي في فلسطين - مجلة اخبار البنوك الإسلامية – IFN,2020 - Dec
